Bus Hound 6.01 capture on Windows Vista (x64). Complements of www.perisoft.net

  Device - Device ID (followed by the endpoint for USB devices)
            (26) Xbox 360 Controller for Windows
            (27) USB Input Device
            (28) HID-compliant game controller
            (30) USB Input Device
            (32) HID Keyboard Device
  Address - FireWire async address or channel number
  Length - Total transfer length
  Phase  - Phase Type
            CTL   USB control transfer       
            IN    Data in transfer           
            OUT   Data out transfer          
            RESET bus reset                  
            USTS  USB status                 
  Data   - Hex dump of the data transferred
  Descr  - Description of the phase
  Delta  - Elapsed time from the previous phase to the current phase
  Cmd... - Position in the captured data
  Date   - Date the phase occurred in year/month/day form
  Time   - Time the phase occurred in hour:minute:second.millisec form
  Driver - Driver that submitted the command
            hidclass     : Hid Class Library 10.0.17134.1 (WinBuild.160101.0800)
            ntoskrnl     : NT Kernel & System 10.0.17134.523 (WinBuild.160101.0800)


Device  Address              Length    Phase  Data                      Description       Delta  Cmd.Phase.Ofs(rep)  Date        Time          Driver      
------  -------------------  --------  -----  ------------------------  ----------------  -----  ------------------  ----------  ------------  ------------
  30.1                              8  IN     00 00 00 00  00 00 00 00  ........          6.6ms         1.1.0(362)   2019/05/16  21:24:49.266  hidclass      
  26.0                                 CTL    80 06 00 01  00 00 12 00  GET DESCRIPTOR    3.6sc       363.1.0        2019/05/16  21:24:52.877  ntoskrnl      
  26.0                             18  IN     12 01 00 02  ff ff ff 40  .......@          270us       363.2.0        2019/05/16  21:24:52.877                
                                              5e 04 8e 02  10 01 01 02  ^.......                      363.2.8                                                
                                              00 01                     ..                            363.2.16                                               
  26.0                                 CTL    80 06 00 02  00 00 09 00  GET DESCRIPTOR     15us       364.1.0        2019/05/16  21:24:52.877  ntoskrnl      
  26.0                              9  IN     09 02 b2 00  05 01 00 a0  ........          230us       364.2.0        2019/05/16  21:24:52.878                
                                              fa                        .                             364.2.8                                                
  26.0                                 CTL    80 06 00 02  00 00 b2 00  GET DESCRIPTOR     15us       365.1.0        2019/05/16  21:24:52.878  ntoskrnl      
  26.0                            178  IN     09 02 b2 00  05 01 00 a0  ........          361us       365.2.0        2019/05/16  21:24:52.878                
                                              fa 09 04 00  00 02 ff 5d  .......]                      365.2.8                                                
                                              01 00 11 21  10 01 01 25  ...!...%                      365.2.16                                               
                                              81 14 03 03  03 04 13 02  ........                      365.2.24                                               
                                              08 03 03 07  05 81 03 20  .......                       365.2.32                                               
                                              00 04 07 05  02 03 20 00  ...... .                      365.2.40                                               
                                              08 09 04 01  00 04 ff 5d  .......]                      365.2.48                                               
                                              03 00 1b 21  00 01 01 01  ...!....                      365.2.56                                               
                                              83 40 01 04  20 16 85 00  .@.. ...                      365.2.64                                               
                                              00 00 00 00  00 16 05 00  ........                      365.2.72                                               
                                              00 00 00 00  00 07 05 83  ........                      365.2.80                                               
                                              03 20 00 02  07 05 04 03  . ......                      365.2.88                                               
                                              20 00 04 07  05 85 03 20   ......                       365.2.96                                               
                                              00 40 07 05  05 03 20 00  .@.... .                      365.2.104                                              
                                              10 09 04 02  00 01 ff 5d  .......]                      365.2.112                                              
                                              02 00 09 21  00 01 01 22  ...!..."                      365.2.120                                              
                                              86 07 00 07  05 86 03 20  .......                       365.2.128                                              
                                              00 10 09 04  03 00 00 ff  ........                      365.2.136                                              
                                              fd 13 04 06  41 00 01 01  ....A...                      365.2.144                                              
                                              03 09 04 04  00 01 03 01  ........                      365.2.152                                              
                                              02 00 09 21  10 01 21 01  ...!..!.                      365.2.160                                              
                                              22 4a 00 07  05 87 03 40  "J.....@                      365.2.168                                              
                                              00 04                     ..                            365.2.176                                              
  26.0                                 CTL    80 00 00 00  00 00 02 00  GET STATUS         18us       366.1.0        2019/05/16  21:24:52.878  ntoskrnl      
  26.0                              2  IN     03 00                     ..                229us       366.2.0        2019/05/16  21:24:52.878                
  26.0                                 CTL    00 09 01 00  00 00 00 00  SET CONFIG         59us       367.1.0        2019/05/16  21:24:52.878  ntoskrnl      
  26.0                                 CTL    01 0b 00 00  01 00 00 00  SET INTERFACE     490us       368.1.0        2019/05/16  21:24:52.879  ntoskrnl      
  26.0                                 CTL    01 0b 00 00  02 00 00 00  SET INTERFACE     120ms       369.1.0        2019/05/16  21:24:52.999  ntoskrnl      
  26.0                                 CTL    01 0b 00 00  04 00 00 00  SET INTERFACE      31ms       370.1.0        2019/05/16  21:24:53.030  ntoskrnl      
  26.0                                 CTL    80 06 02 03  09 04 02 00  GET DESCRIPTOR     31ms       371.1.0        2019/05/16  21:24:53.062  ntoskrnl      
  26.0                              2  IN     16 03                     ..                129us       371.2.0        2019/05/16  21:24:53.062                
  26.0                                 CTL    80 06 02 03  09 04 16 00  GET DESCRIPTOR     20us       372.1.0        2019/05/16  21:24:53.062  ntoskrnl      
  26.0                             22  IN     16 03 43 00  6f 00 6e 00  ..C.o.n.          227us       372.2.0        2019/05/16  21:24:53.062                
                                              74 00 72 00  6f 00 6c 00  t.r.o.l.                      372.2.8                                                
                                              6c 00 65 00  72 00        l.e.r.                        372.2.16                                               
  26.0                                 CTL    c1 01 00 01  00 00 14 00  VENDOR            116us       373.1.0        2019/05/16  21:24:53.062  ntoskrnl      
  26.0                                 CTL    c1 01 00 00  00 00 08 00  VENDOR             32us       374.1.0        2019/05/16  21:24:53.062  ntoskrnl      
  26.0                                 USTS   c0000004                  stall pid         101us       373.2.0        2019/05/16  21:24:53.062                
  26.0                                 CTL    c0 01 00 00  00 00 04 00  VENDOR            199us       375.1.0        2019/05/16  21:24:53.062  ntoskrnl      
  26.0                                 USTS   c0000004                  stall pid          48us       374.2.0        2019/05/16  21:24:53.062                
  26.0                                 USTS   c0000004                  stall pid         134us       375.2.0        2019/05/16  21:24:53.062                
  26.2                              3  OUT    01 03 02                  ...               4.0ms       376.1.0        2019/05/16  21:24:53.066  ntoskrnl      
  26.1                             20  IN     00 14 00 00  00 00 26 03  ......&.           53us       377.1.0        2019/05/16  21:24:53.066  ntoskrnl      
                                              00 00 00 00  00 00 00 00  ........                      377.1.8                                                
                                              00 00 00 00               ....                          377.1.16                                               
  27.0                                 CTL    80 06 00 01  00 00 12 00  GET DESCRIPTOR    4.9ms       378.1.0        2019/05/16  21:24:53.071  ntoskrnl      
  27.0                             18  IN     12 01 00 02  03 00 00 20  .......            13us       378.2.0        2019/05/16  21:24:53.071                
                                              5e 04 8e 02  00 00 00 01  ^.......                      378.2.8                                                
                                              00 01                     ..                            378.2.16                                               
  27.0                                 CTL    80 06 00 02  00 00 09 00  GET DESCRIPTOR     13us       379.1.0        2019/05/16  21:24:53.071  ntoskrnl      
  27.0                              9  IN     09 02 22 00  01 01 00 a0  ..".....            7us       379.2.0        2019/05/16  21:24:53.071                
                                              32                        2                             379.2.8                                                
  27.0                                 CTL    80 06 00 02  00 00 22 00  GET DESCRIPTOR     10us       380.1.0        2019/05/16  21:24:53.071  ntoskrnl      
  27.0                             34  IN     09 02 22 00  01 01 00 a0  ..".....            6us       380.2.0        2019/05/16  21:24:53.071                
                                              32 09 04 00  00 01 03 00  2.......                      380.2.8                                                
                                              00 00 09 21  11 01 00 01  ...!....                      380.2.16                                               
                                              22 78 00 07  05 09 03 20  "x.....                       380.2.24                                               
                                              00 04                     ..                            380.2.32                                               
  27.0                                 CTL    00 09 01 00  00 00 00 00  SET CONFIG         16us       381.1.0        2019/05/16  21:24:53.071  ntoskrnl      
  27.0                                 CTL    21 0a 00 00  00 00 00 00  SET IDLE           11us       382.1.0        2019/05/16  21:24:53.071  ntoskrnl      
  27.0                                 CTL    81 06 00 22  00 00 b8 00  GET DESCRIPTOR     16us       383.1.0        2019/05/16  21:24:53.071  ntoskrnl      
  27.0                            120  IN     05 01 09 05  a1 01 a1 00  ........            7us       383.2.0        2019/05/16  21:24:53.071                
                                              09 30 09 31  15 00 26 ff  .0.1..&.                      383.2.8                                                
                                              ff 35 00 46  ff ff 95 02  .5.F....                      383.2.16                                               
                                              75 10 81 02  c0 a1 00 09  u.......                      383.2.24                                               
                                              33 09 34 15  00 26 ff ff  3.4..&..                      383.2.32                                               
                                              35 00 46 ff  ff 95 02 75  5.F....u                      383.2.40                                               
                                              10 81 02 c0  a1 00 09 32  .......2                      383.2.48                                               
                                              15 00 26 ff  ff 35 00 46  ..&..5.F                      383.2.56                                               
                                              ff ff 95 01  75 10 81 02  ....u...                      383.2.64                                               
                                              c0 05 09 19  01 29 0a 95  .....)..                      383.2.72                                               
                                              0a 75 01 81  02 05 01 09  .u......                      383.2.80                                               
                                              39 15 01 25  08 35 00 46  9..%.5.F                      383.2.88                                               
                                              3b 10 66 0e  00 75 04 95  ;.f..u..                      383.2.96                                               
                                              01 81 42 75  02 95 01 81  ..Bu....                      383.2.104                                              
                                              03 75 08 95  02 81 03 c0  .u......                      383.2.112                                              
  26.2                              3  OUT    02 08 03                  ...               2.8ms       384.1.0        2019/05/16  21:24:53.074  ntoskrnl      
  26.1                             20  IN     00 14 00 00  00 00 b9 06  ........           19us       385.1.0        2019/05/16  21:24:53.074  ntoskrnl      
                                              00 00 00 00  00 00 00 00  ........                      385.1.8                                                
                                              00 00 00 00               ....                          385.1.16                                               
  26.2                              3  OUT    01 03 02                  ...               7.9ms       386.1.0        2019/05/16  21:24:53.082  ntoskrnl      
  26.1                             20  IN     00 14 00 00  00 00 c9 01  ........           24us       387.1.0        2019/05/16  21:24:53.082  ntoskrnl      
                                              00 00 00 00  00 00 00 00  ........                      387.1.8                                                
                                              00 00 00 00               ....                          387.1.16                                               
  27.1                             14  IN     c9 81 ff 7f  00 80 ff 7f  ........           13us       388.1.0        2019/05/16  21:24:53.082  hidclass      
                                              00 80 00 40  00 f8        ...@..                        388.1.8                                                
  26.1                             20  IN     00 14 00 00  00 00 02 03  ........          7.9ms       389.1.0        2019/05/16  21:24:53.090  ntoskrnl      
                                              00 00 00 00  00 00 00 00  ........                      389.1.8                                                
                                              00 00 00 00               ....                          389.1.16                                               
  27.1                             14  IN     02 83 ff 7f  00 80 ff 7f  ........           18us       390.1.0        2019/05/16  21:24:53.090  hidclass      
                                              00 80 00 40  00 f8        ...@..                        390.1.8                                                
  26.1                             20  IN     00 14 00 00  00 00 5c 05  ......\.          7.9ms       391.1.0        2019/05/16  21:24:53.098  ntoskrnl      
                                              00 00 00 00  00 00 00 00  ........                      391.1.8                                                
                                              00 00 00 00               ....                          391.1.16                                               
  27.1                             14  IN     5c 85 ff 7f  00 80 ff 7f  \.......           14us       392.1.0        2019/05/16  21:24:53.098  hidclass      
                                              00 80 00 40  00 f8        ...@..                        392.1.8                                                
  26.1                             20  IN     00 14 00 00  00 00 5f 04  ......_.          7.9ms       393.1.0        2019/05/16  21:24:53.106  ntoskrnl      
                                              00 00 00 00  00 00 00 00  ........                      393.1.8                                                
                                              00 00 00 00               ....                          393.1.16                                               
  27.1                             14  IN     5f 84 ff 7f  00 80 ff 7f  _.......           15us       394.1.0        2019/05/16  21:24:53.106  hidclass      
                                              00 80 00 40  00 f8        ...@..                        394.1.8                                                
  26.1                             20  IN     00 14 00 00  00 00 5c 05  ......\.          7.9ms       395.1.0(2)     2019/05/16  21:24:53.114  ntoskrnl      
                                              00 00 00 00  00 00 00 00  ........                      395.1.8                                                
                                              00 00 00 00               ....                          395.1.16                                               
  27.1                             14  IN     5c 85 ff 7f  00 80 ff 7f  \.......           16us       396.1.0(2)     2019/05/16  21:24:53.114  hidclass      
                                              00 80 00 40  00 f8        ...@..                        396.1.8                                                
  26.5                                 USTS   c0000004                  stall pid          15ms       399.1.0        2019/05/16  21:24:53.130  ntoskrnl      
  26.1                             20  IN     00 14 00 00  00 00 23 04  ......#.           31us       400.1.0        2019/05/16  21:24:53.130  ntoskrnl      
                                              00 00 00 00  00 00 00 00  ........                      400.1.8                                                
                                              00 00 00 00               ....                          400.1.16                                               
  27.1                             14  IN     23 84 ff 7f  00 80 ff 7f  #.......           14us       401.1.0        2019/05/16  21:24:53.130  hidclass      
                                              00 80 00 40  00 f8        ...@..                        401.1.8                                                
  26.1                             20  IN     00 14 00 00  00 00 98 05  ........          7.9ms       402.1.0        2019/05/16  21:24:53.138  ntoskrnl      
                                              00 00 00 00  00 00 00 00  ........                      402.1.8                                                
                                              00 00 00 00               ....                          402.1.16                                               
  27.1                             14  IN     98 85 ff 7f  00 80 ff 7f  ........           23us       403.1.0        2019/05/16  21:24:53.138  hidclass      
                                              00 80 00 40  00 f8        ...@..                        403.1.8                                                
  26.1                             20  IN     00 14 00 00  00 00 b9 06  ........          7.9ms       404.1.0        2019/05/16  21:24:53.146  ntoskrnl      
                                              00 00 00 00  00 00 00 00  ........                      404.1.8                                                
                                              00 00 00 00               ....                          404.1.16                                               
  27.1                             14  IN     b9 86 ff 7f  00 80 ff 7f  ........           18us       405.1.0        2019/05/16  21:24:53.146  hidclass      
                                              00 80 00 40  00 f8        ...@..                        405.1.8                                                
  26.5                                 RESET                                              6.7ms       406.1.0        2019/05/16  21:24:53.153  ntoskrnl      
  26.5                                 USTS   c0000004                  stall pid         239us       406.2.0        2019/05/16  21:24:53.153                
  26.1                             20  IN     00 14 00 00  00 00 98 05  ........          1.0ms       407.1.0        2019/05/16  21:24:53.154  ntoskrnl      
                                              00 00 00 00  00 00 00 00  ........                      407.1.8                                                
                                              00 00 00 00               ....                          407.1.16                                               
  27.1                             14  IN     98 85 ff 7f  00 80 ff 7f  ........           14us       408.1.0        2019/05/16  21:24:53.154  hidclass      
                                              00 80 00 40  00 f8        ...@..                        408.1.8                                                
  26.1                             20  IN     00 14 00 00  00 00 b9 06  ........          7.9ms       409.1.0        2019/05/16  21:24:53.162  ntoskrnl      
                                              00 00 00 00  00 00 00 00  ........                      409.1.8                                                
                                              00 00 00 00               ....                          409.1.16                                               
  27.1                             14  IN     b9 86 ff 7f  00 80 ff 7f  ........           19us       410.1.0        2019/05/16  21:24:53.162  hidclass      
                                              00 80 00 40  00 f8        ...@..                        410.1.8                                                
  26.1                             20  IN     00 14 00 00  00 00 5c 05  ......\.          7.9ms       411.1.0        2019/05/16  21:24:53.170  ntoskrnl      
                                              00 00 00 00  00 00 00 00  ........                      411.1.8                                                
                                              00 00 00 00               ....                          411.1.16                                               
  27.1                             14  IN     5c 85 ff 7f  00 80 ff 7f  \.......           19us       412.1.0        2019/05/16  21:24:53.170  hidclass      
                                              00 80 00 40  00 f8        ...@..                        412.1.8                                                
  26.1                             20  IN     00 14 00 00  00 00 e9 06  ........          7.9ms       413.1.0        2019/05/16  21:24:53.178  ntoskrnl      
                                              00 00 00 00  00 00 00 00  ........                      413.1.8                                                
                                              00 00 00 00               ....                          413.1.16                                               
  27.1                             14  IN     e9 86 ff 7f  00 80 ff 7f  ........           14us       414.1.0        2019/05/16  21:24:53.178  hidclass      
                                              00 80 00 40  00 f8        ...@..                        414.1.8                                                
  26.1                             20  IN     00 14 00 00  00 00 47 04  ......G.          7.9ms       415.1.0(2)     2019/05/16  21:24:53.186  ntoskrnl      
                                              00 00 00 00  00 00 00 00  ........                      415.1.8                                                
                                              00 00 00 00               ....                          415.1.16                                               
  27.1                             14  IN     47 84 ff 7f  00 80 ff 7f  G.......           16us       416.1.0(2)     2019/05/16  21:24:53.186  hidclass      
                                              00 80 00 40  00 f8        ...@..                        416.1.8                                                
  26.1                             20  IN     00 14 00 00  00 00 5c 05  ......\.           15ms       419.1.0(2)     2019/05/16  21:24:53.202  ntoskrnl      
                                              00 00 00 00  00 00 00 00  ........                      419.1.8                                                
                                              00 00 00 00               ....                          419.1.16                                               
  27.1                             14  IN     5c 85 ff 7f  00 80 ff 7f  \.......           16us       420.1.0(2)     2019/05/16  21:24:53.202  hidclass      
                                              00 80 00 40  00 f8        ...@..                        420.1.8                                                
  26.1                             20  IN     00 14 00 00  00 00 94 06  ........           15ms       423.1.0        2019/05/16  21:24:53.218  ntoskrnl      
                                              00 00 00 00  00 00 00 00  ........                      423.1.8                                                
                                              00 00 00 00               ....                          423.1.16                                               
  27.1                             14  IN     94 86 ff 7f  00 80 ff 7f  ........           14us       424.1.0        2019/05/16  21:24:53.218  hidclass      
                                              00 80 00 40  00 f8        ...@..                        424.1.8                                                
  26.1                             20  IN     00 14 00 00  00 00 47 04  ......G.          7.9ms       425.1.0(2)     2019/05/16  21:24:53.226  ntoskrnl      
                                              00 00 00 00  00 00 00 00  ........                      425.1.8                                                
                                              00 00 00 00               ....                          425.1.16                                               
  27.1                             14  IN     47 84 ff 7f  00 80 ff 7f  G.......           15us       426.1.0(2)     2019/05/16  21:24:53.226  hidclass      
                                              00 80 00 40  00 f8        ...@..                        426.1.8                                                
  26.1                             20  IN     00 14 00 00  00 00 4a 03  ......J.           15ms       429.1.0        2019/05/16  21:24:53.242  ntoskrnl      
                                              00 00 00 00  00 00 00 00  ........                      429.1.8                                                
                                              00 00 00 00               ....                          429.1.16                                               
  27.1                             14  IN     4a 83 ff 7f  00 80 ff 7f  J.......           17us       430.1.0        2019/05/16  21:24:53.242  hidclass      
                                              00 80 00 40  00 f8        ...@..                        430.1.8                                                
  26.1                             20  IN     00 14 00 00  00 00 47 04  ......G.          7.9ms       431.1.0        2019/05/16  21:24:53.250  ntoskrnl      
                                              00 00 00 00  00 00 00 00  ........                      431.1.8                                                
                                              00 00 00 00               ....                          431.1.16                                               
  27.1                             14  IN     47 84 ff 7f  00 80 ff 7f  G.......           16us       432.1.0        2019/05/16  21:24:53.250  hidclass      
                                              00 80 00 40  00 f8        ...@..                        432.1.8                                                
  26.1                             20  IN     00 14 00 00  00 00 f1 07  ........          7.9ms       433.1.0        2019/05/16  21:24:53.258  ntoskrnl      
                                              00 00 00 00  00 00 00 00  ........                      433.1.8                                                
                                              00 00 00 00               ....                          433.1.16                                               
  27.1                             14  IN     f1 87 ff 7f  00 80 ff 7f  ........           18us       434.1.0        2019/05/16  21:24:53.258  hidclass      
                                              00 80 00 40  00 f8        ...@..                        434.1.8                                                
  26.1                             20  IN     00 14 00 00  00 00 c6 02  ........          8.0ms       435.1.0        2019/05/16  21:24:53.266  ntoskrnl      
                                              00 00 00 00  00 00 00 00  ........                      435.1.8                                                
                                              00 00 00 00               ....                          435.1.16                                               
  27.1                             14  IN     c6 82 ff 7f  00 80 ff 7f  ........           17us       436.1.0        2019/05/16  21:24:53.266  hidclass      
                                              00 80 00 40  00 f8        ...@..                        436.1.8                                                
  26.1                             20  IN     00 14 00 00  00 00 94 06  ........          7.9ms       437.1.0        2019/05/16  21:24:53.274  ntoskrnl      
                                              00 00 00 00  00 00 00 00  ........                      437.1.8                                                
                                              00 00 00 00               ....                          437.1.16                                               
  27.1                             14  IN     94 86 ff 7f  00 80 ff 7f  ........           21us       438.1.0        2019/05/16  21:24:53.274  hidclass      
                                              00 80 00 40  00 f8        ...@..                        438.1.8                                                
  26.1                             20  IN     00 14 00 00  00 00 5c 05  ......\.          7.9ms       439.1.0        2019/05/16  21:24:53.282  ntoskrnl      
                                              00 00 00 00  00 00 00 00  ........                      439.1.8                                                
                                              00 00 00 00               ....                          439.1.16                                               
  27.1                             14  IN     5c 85 ff 7f  00 80 ff 7f  \.......           17us       440.1.0        2019/05/16  21:24:53.282  hidclass      
                                              00 80 00 40  00 f8        ...@..                        440.1.8                                                
  26.1                             20  IN     00 14 00 00  00 00 b9 06  ........          7.9ms       441.1.0        2019/05/16  21:24:53.290  ntoskrnl      
                                              00 00 00 00  00 00 00 00  ........                      441.1.8                                                
                                              00 00 00 00               ....                          441.1.16                                               
  27.1                             14  IN     b9 86 ff 7f  00 80 ff 7f  ........           17us       442.1.0        2019/05/16  21:24:53.290  hidclass      
                                              00 80 00 40  00 f8        ...@..                        442.1.8                                                
  26.1                             20  IN     00 14 00 00  00 00 fe 03  ........          7.9ms       443.1.0        2019/05/16  21:24:53.298  ntoskrnl      
                                              00 00 00 00  00 00 00 00  ........                      443.1.8                                                
                                              00 00 00 00               ....                          443.1.16                                               
  27.1                             14  IN     fe 83 ff 7f  00 80 ff 7f  ........           16us       444.1.0        2019/05/16  21:24:53.298  hidclass      
                                              00 80 00 40  00 f8        ...@..                        444.1.8                                                
  26.1                             20  IN     00 14 00 00  00 00 47 04  ......G.          7.9ms       445.1.0        2019/05/16  21:24:53.306  ntoskrnl      
                                              00 00 00 00  00 00 00 00  ........                      445.1.8                                                
                                              00 00 00 00               ....                          445.1.16                                               
  27.1                             14  IN     47 84 ff 7f  00 80 ff 7f  G.......           19us       446.1.0        2019/05/16  21:24:53.306  hidclass      
                                              00 80 00 40  00 f8        ...@..                        446.1.8                                                
  26.1                             20  IN     00 14 00 00  00 00 98 05  ........          7.9ms       447.1.0        2019/05/16  21:24:53.314  ntoskrnl      
                                              00 00 00 00  00 00 00 00  ........                      447.1.8                                                
                                              00 00 00 00               ....                          447.1.16                                               
  27.1                             14  IN     98 85 ff 7f  00 80 ff 7f  ........           17us       448.1.0        2019/05/16  21:24:53.314  hidclass      
                                              00 80 00 40  00 f8        ...@..                        448.1.8                                                
  26.1                             20  IN     00 14 00 00  00 00 94 06  ........          8.0ms       449.1.0        2019/05/16  21:24:53.322  ntoskrnl      
                                              00 00 00 00  00 00 00 00  ........                      449.1.8                                                
                                              00 00 00 00               ....                          449.1.16                                               
  27.1                             14  IN     94 86 ff 7f  00 80 ff 7f  ........           30us       450.1.0        2019/05/16  21:24:53.322  hidclass      
                                              00 80 00 40  00 f8        ...@..                        450.1.8                                                
  26.1                             20  IN     00 14 00 00  00 00 5c 05  ......\.          7.9ms       451.1.0        2019/05/16  21:24:53.330  ntoskrnl      
                                              00 00 00 00  00 00 00 00  ........                      451.1.8                                                
                                              00 00 00 00               ....                          451.1.16                                               
  27.1                             14  IN     5c 85 ff 7f  00 80 ff 7f  \.......           17us       452.1.0        2019/05/16  21:24:53.330  hidclass      
                                              00 80 00 40  00 f8        ...@..                        452.1.8                                                
  26.1                             20  IN     00 14 00 00  00 00 26 03  ......&.          7.9ms       453.1.0        2019/05/16  21:24:53.338  ntoskrnl      
                                              00 00 00 00  00 00 00 00  ........                      453.1.8                                                
                                              00 00 00 00               ....                          453.1.16                                               
  27.1                             14  IN     26 83 ff 7f  00 80 ff 7f  &.......           18us       454.1.0        2019/05/16  21:24:53.338  hidclass      
                                              00 80 00 40  00 f8        ...@..                        454.1.8                                                
  26.1                             20  IN     00 14 00 00  00 00 c9 01  ........          7.9ms       455.1.0        2019/05/16  21:24:53.346  ntoskrnl      
                                              00 00 00 00  00 00 00 00  ........                      455.1.8                                                
                                              00 00 00 00               ....                          455.1.16                                               
  27.1                             14  IN     c9 81 ff 7f  00 80 ff 7f  ........           17us       456.1.0        2019/05/16  21:24:53.346  hidclass      
                                              00 80 00 40  00 f8        ...@..                        456.1.8                                                
  26.1                             20  IN     00 14 00 00  00 00 47 04  ......G.          7.9ms       457.1.0(2)     2019/05/16  21:24:53.354  ntoskrnl      
                                              00 00 00 00  00 00 00 00  ........                      457.1.8                                                
                                              00 00 00 00               ....                          457.1.16                                               
  27.1                             14  IN     47 84 ff 7f  00 80 ff 7f  G.......           16us       458.1.0(2)     2019/05/16  21:24:53.354  hidclass      
                                              00 80 00 40  00 f8        ...@..                        458.1.8                                                
  26.1                             20  IN     00 14 00 00  00 00 02 03  ........           15ms       461.1.0        2019/05/16  21:24:53.370  ntoskrnl      
                                              00 00 00 00  00 00 00 00  ........                      461.1.8                                                
                                              00 00 00 00               ....                          461.1.16                                               
  27.1                             14  IN     02 83 ff 7f  00 80 ff 7f  ........           17us       462.1.0        2019/05/16  21:24:53.370  hidclass      
                                              00 80 00 40  00 f8        ...@..                        462.1.8                                                
  26.1                             20  IN     00 14 00 00  00 00 47 04  ......G.          7.9ms       463.1.0        2019/05/16  21:24:53.378  ntoskrnl      
                                              00 00 00 00  00 00 00 00  ........                      463.1.8                                                
                                              00 00 00 00               ....                          463.1.16                                               
  27.1                             14  IN     47 84 ff 7f  00 80 ff 7f  G.......           17us       464.1.0        2019/05/16  21:24:53.378  hidclass      
                                              00 80 00 40  00 f8        ...@..                        464.1.8                                                
  26.1                             20  IN     00 14 00 00  00 00 94 06  ........          7.9ms       465.1.0        2019/05/16  21:24:53.386  ntoskrnl      
                                              00 00 00 00  00 00 00 00  ........                      465.1.8                                                
                                              00 00 00 00               ....                          465.1.16                                               
  27.1                             14  IN     94 86 ff 7f  00 80 ff 7f  ........           20us       466.1.0        2019/05/16  21:24:53.386  hidclass      
                                              00 80 00 40  00 f8        ...@..                        466.1.8                                                
  26.1                             20  IN     00 14 00 00  00 00 80 05  ........          7.9ms       467.1.0        2019/05/16  21:24:53.394  ntoskrnl      
                                              00 00 00 00  00 00 00 00  ........                      467.1.8                                                
                                              00 00 00 00               ....                          467.1.16                                               
  27.1                             14  IN     80 85 ff 7f  00 80 ff 7f  ........           16us       468.1.0        2019/05/16  21:24:53.394  hidclass      
                                              00 80 00 40  00 f8        ...@..                        468.1.8                                                
  26.1                             20  IN     00 14 00 00  00 00 23 04  ......#.          7.9ms       469.1.0        2019/05/16  21:24:53.402  ntoskrnl      
                                              00 00 00 00  00 00 00 00  ........                      469.1.8                                                
                                              00 00 00 00               ....                          469.1.16                                               
  27.1                             14  IN     23 84 ff 7f  00 80 ff 7f  #.......           16us       470.1.0        2019/05/16  21:24:53.402  hidclass      
                                              00 80 00 40  00 f8        ...@..                        470.1.8                                                
  26.1                             20  IN     00 14 00 00  00 00 26 03  ......&.          7.9ms       471.1.0        2019/05/16  21:24:53.410  ntoskrnl      
                                              00 00 00 00  00 00 00 00  ........                      471.1.8                                                
                                              00 00 00 00               ....                          471.1.16                                               
  27.1                             14  IN     26 83 ff 7f  00 80 ff 7f  &.......           17us       472.1.0        2019/05/16  21:24:53.410  hidclass      
                                              00 80 00 40  00 f8        ...@..                        472.1.8                                                
  26.1                             20  IN     00 14 00 00  00 00 02 03  ........          7.9ms       473.1.0        2019/05/16  21:24:53.418  ntoskrnl      
                                              00 00 00 00  00 00 00 00  ........                      473.1.8                                                
                                              00 00 00 00               ....                          473.1.16                                               
  27.1                             14  IN     02 83 ff 7f  00 80 ff 7f  ........           17us       474.1.0        2019/05/16  21:24:53.418  hidclass      
                                              00 80 00 40  00 f8        ...@..                        474.1.8                                                
  26.1                             20  IN     00 14 00 00  00 00 47 04  ......G.          7.9ms       475.1.0        2019/05/16  21:24:53.426  ntoskrnl      
                                              00 00 00 00  00 00 00 00  ........                      475.1.8                                                
                                              00 00 00 00               ....                          475.1.16                                               
  27.1                             14  IN     47 84 ff 7f  00 80 ff 7f  G.......           16us       476.1.0        2019/05/16  21:24:53.426  hidclass      
                                              00 80 00 40  00 f8        ...@..                        476.1.8                                                
  26.1                             20  IN     00 14 00 00  00 00 5f 04  ......_.          7.9ms       477.1.0        2019/05/16  21:24:53.434  ntoskrnl      
                                              00 00 00 00  00 00 00 00  ........                      477.1.8                                                
                                              00 00 00 00               ....                          477.1.16                                               
  27.1                             14  IN     5f 84 ff 7f  00 80 ff 7f  _.......           20us       478.1.0        2019/05/16  21:24:53.434  hidclass      
                                              00 80 00 40  00 f8        ...@..                        478.1.8                                                
  26.1                             20  IN     00 14 00 00  00 00 80 05  ........          7.9ms       479.1.0        2019/05/16  21:24:53.442  ntoskrnl      
                                              00 00 00 00  00 00 00 00  ........                      479.1.8                                                
                                              00 00 00 00               ....                          479.1.16                                               
  27.1                             14  IN     80 85 ff 7f  00 80 ff 7f  ........           18us       480.1.0        2019/05/16  21:24:53.442  hidclass      
                                              00 80 00 40  00 f8        ...@..                        480.1.8                                                
  26.1                             20  IN     00 14 00 00  00 00 47 04  ......G.          7.9ms       481.1.0(2)     2019/05/16  21:24:53.450  ntoskrnl      
                                              00 00 00 00  00 00 00 00  ........                      481.1.8                                                
                                              00 00 00 00               ....                          481.1.16                                               
  27.1                             14  IN     47 84 ff 7f  00 80 ff 7f  G.......           15us       482.1.0(2)     2019/05/16  21:24:53.450  hidclass      
                                              00 80 00 40  00 f8        ...@..                        482.1.8                                                
  26.1                             20  IN     00 14 00 00  00 00 23 04  ......#.           15ms       485.1.0(2)     2019/05/16  21:24:53.466  ntoskrnl      
                                              00 00 00 00  00 00 00 00  ........                      485.1.8                                                
                                              00 00 00 00               ....                          485.1.16                                               
  27.1                             14  IN     23 84 ff 7f  00 80 ff 7f  #.......           17us       486.1.0(2)     2019/05/16  21:24:53.466  hidclass      
                                              00 80 00 40  00 f8        ...@..                        486.1.8                                                
  26.1                             20  IN     00 14 00 00  00 00 47 04  ......G.           15ms       489.1.0        2019/05/16  21:24:53.482  ntoskrnl      
                                              00 00 00 00  00 00 00 00  ........                      489.1.8                                                
                                              00 00 00 00               ....                          489.1.16                                               
  27.1                             14  IN     47 84 ff 7f  00 80 ff 7f  G.......           17us       490.1.0        2019/05/16  21:24:53.482  hidclass      
                                              00 80 00 40  00 f8        ...@..                        490.1.8                                                
  26.1                             20  IN     00 14 00 00  00 00 ea 02  ........          7.9ms       491.1.0        2019/05/16  21:24:53.490  ntoskrnl      
                                              00 00 00 00  00 00 00 00  ........                      491.1.8                                                
                                              00 00 00 00               ....                          491.1.16                                               
  27.1                             14  IN     ea 82 ff 7f  00 80 ff 7f  ........           17us       492.1.0        2019/05/16  21:24:53.490  hidclass      
                                              00 80 00 40  00 f8        ...@..                        492.1.8                                                
  26.1                             20  IN     00 14 00 00  00 00 fe 03  ........          7.9ms       493.1.0        2019/05/16  21:24:53.498  ntoskrnl      
                                              00 00 00 00  00 00 00 00  ........                      493.1.8                                                
                                              00 00 00 00               ....                          493.1.16                                               
  27.1                             14  IN     fe 83 ff 7f  00 80 ff 7f  ........           17us       494.1.0        2019/05/16  21:24:53.498  hidclass      
                                              00 80 00 40  00 f8        ...@..                        494.1.8                                                
  26.1                             20  IN     00 14 00 00  00 00 80 05  ........          7.9ms       495.1.0        2019/05/16  21:24:53.506  ntoskrnl      
                                              00 00 00 00  00 00 00 00  ........                      495.1.8                                                
                                              00 00 00 00               ....                          495.1.16                                               
  27.1                             14  IN     80 85 ff 7f  00 80 ff 7f  ........           16us       496.1.0        2019/05/16  21:24:53.506  hidclass      
                                              00 80 00 40  00 f8        ...@..                        496.1.8                                                
  26.1                             20  IN     00 14 00 00  00 00 02 03  ........          7.9ms       497.1.0        2019/05/16  21:24:53.514  ntoskrnl      
                                              00 00 00 00  00 00 00 00  ........                      497.1.8                                                
                                              00 00 00 00               ....                          497.1.16                                               
  27.1                             14  IN     02 83 ff 7f  00 80 ff 7f  ........           15us       498.1.0        2019/05/16  21:24:53.514  hidclass      
                                              00 80 00 40  00 f8        ...@..                        498.1.8                                                
  26.1                             20  IN     00 14 00 00  00 00 43 05  ......C.          7.9ms       499.1.0        2019/05/16  21:24:53.522  ntoskrnl      
                                              00 00 00 00  00 00 00 00  ........                      499.1.8                                                
                                              00 00 00 00               ....                          499.1.16                                               
  27.1                             14  IN     43 85 ff 7f  00 80 ff 7f  C.......           19us       500.1.0        2019/05/16  21:24:53.522  hidclass      
                                              00 80 00 40  00 f8        ...@..                        500.1.8                                                
  26.1                             20  IN     00 14 00 00  00 00 47 04  ......G.          7.9ms       501.1.0        2019/05/16  21:24:53.530  ntoskrnl      
                                              00 00 00 00  00 00 00 00  ........                      501.1.8                                                
                                              00 00 00 00               ....                          501.1.16                                               
  27.1                             14  IN     47 84 ff 7f  00 80 ff 7f  G.......           19us       502.1.0        2019/05/16  21:24:53.530  hidclass      
                                              00 80 00 40  00 f8        ...@..                        502.1.8                                                
  26.1                             20  IN     00 14 00 00  00 00 94 06  ........          7.9ms       503.1.0        2019/05/16  21:24:53.538  ntoskrnl      
                                              00 00 00 00  00 00 00 00  ........                      503.1.8                                                
                                              00 00 00 00               ....                          503.1.16                                               
  27.1                             14  IN     94 86 ff 7f  00 80 ff 7f  ........           17us       504.1.0        2019/05/16  21:24:53.538  hidclass      
                                              00 80 00 40  00 f8        ...@..                        504.1.8                                                
  26.1                             20  IN     00 14 00 00  00 00 80 05  ........          7.9ms       505.1.0        2019/05/16  21:24:53.546  ntoskrnl      
                                              00 00 00 00  00 00 00 00  ........                      505.1.8                                                
                                              00 00 00 00               ....                          505.1.16                                               
  27.1                             14  IN     80 85 ff 7f  00 80 ff 7f  ........           19us       506.1.0        2019/05/16  21:24:53.546  hidclass      
                                              00 80 00 40  00 f8        ...@..                        506.1.8                                                
  26.1                             20  IN     00 14 00 00  00 00 23 04  ......#.          8.0ms       507.1.0        2019/05/16  21:24:53.554  ntoskrnl      
                                              00 00 00 00  00 00 00 00  ........                      507.1.8                                                
                                              00 00 00 00               ....                          507.1.16                                               
  27.1                             14  IN     23 84 ff 7f  00 80 ff 7f  #.......           18us       508.1.0        2019/05/16  21:24:53.554  hidclass      
                                              00 80 00 40  00 f8        ...@..                        508.1.8                                                
  26.1                             20  IN     00 14 00 00  00 00 5f 04  ......_.          7.9ms       509.1.0        2019/05/16  21:24:53.562  ntoskrnl      
                                              00 00 00 00  00 00 00 00  ........                      509.1.8                                                
                                              00 00 00 00               ....                          509.1.16                                               
  27.1                             14  IN     5f 84 ff 7f  00 80 ff 7f  _.......           16us       510.1.0        2019/05/16  21:24:53.562  hidclass      
                                              00 80 00 40  00 f8        ...@..                        510.1.8                                                
  26.1                             20  IN     00 14 00 00  00 00 5c 05  ......\.          7.9ms       511.1.0        2019/05/16  21:24:53.570  ntoskrnl      
                                              00 00 00 00  00 00 00 00  ........                      511.1.8                                                
                                              00 00 00 00               ....                          511.1.16                                               
  27.1                             14  IN     5c 85 ff 7f  00 80 ff 7f  \.......           17us       512.1.0        2019/05/16  21:24:53.570  hidclass      
                                              00 80 00 40  00 f8        ...@..                        512.1.8                                                
  26.1                             20  IN     00 14 00 00  00 00 5f 04  ......_.          7.9ms       513.1.0(2)     2019/05/16  21:24:53.578  ntoskrnl      
                                              00 00 00 00  00 00 00 00  ........                      513.1.8                                                
                                              00 00 00 00               ....                          513.1.16                                               
  27.1                             14  IN     5f 84 ff 7f  00 80 ff 7f  _.......           18us       514.1.0(2)     2019/05/16  21:24:53.578  hidclass      
                                              00 80 00 40  00 f8        ...@..                        514.1.8                                                
  26.1                             20  IN     00 14 00 00  00 00 80 05  ........           16ms       517.1.0        2019/05/16  21:24:53.594  ntoskrnl      
                                              00 00 00 00  00 00 00 00  ........                      517.1.8                                                
                                              00 00 00 00               ....                          517.1.16                                               
  27.1                             14  IN     80 85 ff 7f  00 80 ff 7f  ........           53us       518.1.0        2019/05/16  21:24:53.595  hidclass      
                                              00 80 00 40  00 f8        ...@..                        518.1.8                                                
  26.1                             20  IN     00 14 00 00  00 00 47 04  ......G.          7.8ms       519.1.0        2019/05/16  21:24:53.602  ntoskrnl      
                                              00 00 00 00  00 00 00 00  ........                      519.1.8                                                
                                              00 00 00 00               ....                          519.1.16                                               
  27.1                             14  IN     47 84 ff 7f  00 80 ff 7f  G.......           16us       520.1.0        2019/05/16  21:24:53.602  hidclass      
                                              00 80 00 40  00 f8        ...@..                        520.1.8                                                
  26.1                             20  IN     00 14 00 00  00 00 5f 04  ......_.          8.0ms       521.1.0        2019/05/16  21:24:53.610  ntoskrnl      
                                              00 00 00 00  00 00 00 00  ........                      521.1.8                                                
                                              00 00 00 00               ....                          521.1.16                                               
  27.1                             14  IN     5f 84 ff 7f  00 80 ff 7f  _.......           26us       522.1.0        2019/05/16  21:24:53.610  hidclass      
                                              00 80 00 40  00 f8        ...@..                        522.1.8                                                
  26.1                             20  IN     00 14 00 00  00 00 ea 02  ........          7.9ms       523.1.0        2019/05/16  21:24:53.618  ntoskrnl      
                                              00 00 00 00  00 00 00 00  ........                      523.1.8                                                
                                              00 00 00 00               ....                          523.1.16                                               
  27.1                             14  IN     ea 82 ff 7f  00 80 ff 7f  ........           19us       524.1.0        2019/05/16  21:24:53.618  hidclass      
                                              00 80 00 40  00 f8        ...@..                        524.1.8                                                
  26.1                             20  IN     00 14 00 00  00 00 c9 01  ........          7.9ms       525.1.0        2019/05/16  21:24:53.626  ntoskrnl      
                                              00 00 00 00  00 00 00 00  ........                      525.1.8                                                
                                              00 00 00 00               ....                          525.1.16                                               
  27.1                             14  IN     c9 81 ff 7f  00 80 ff 7f  ........           18us       526.1.0        2019/05/16  21:24:53.626  hidclass      
                                              00 80 00 40  00 f8        ...@..                        526.1.8                                                
  26.1                             20  IN     00 14 00 00  00 00 5c 05  ......\.          7.9ms       527.1.0        2019/05/16  21:24:53.634  ntoskrnl      
                                              00 00 00 00  00 00 00 00  ........                      527.1.8                                                
                                              00 00 00 00               ....                          527.1.16                                               
  27.1                             14  IN     5c 85 ff 7f  00 80 ff 7f  \.......           14us       528.1.0        2019/05/16  21:24:53.634  hidclass      
                                              00 80 00 40  00 f8        ...@..                        528.1.8                                                
  26.1                             20  IN     00 14 00 00  00 00 80 05  ........          7.9ms       529.1.0        2019/05/16  21:24:53.642  ntoskrnl      
                                              00 00 00 00  00 00 00 00  ........                      529.1.8                                                
                                              00 00 00 00               ....                          529.1.16                                               
  27.1                             14  IN     80 85 ff 7f  00 80 ff 7f  ........           13us       530.1.0        2019/05/16  21:24:53.642  hidclass      
                                              00 80 00 40  00 f8        ...@..                        530.1.8                                                
  26.1                             20  IN     00 14 00 00  00 00 02 03  ........          7.9ms       531.1.0        2019/05/16  21:24:53.650  ntoskrnl      
                                              00 00 00 00  00 00 00 00  ........                      531.1.8                                                
                                              00 00 00 00               ....                          531.1.16                                               
  27.1                             14  IN     02 83 ff 7f  00 80 ff 7f  ........           14us       532.1.0        2019/05/16  21:24:53.650  hidclass      
                                              00 80 00 40  00 f8        ...@..                        532.1.8                                                
  26.1                             20  IN     00 14 00 00  00 00 94 06  ........          7.9ms       533.1.0        2019/05/16  21:24:53.658  ntoskrnl      
                                              00 00 00 00  00 00 00 00  ........                      533.1.8                                                
                                              00 00 00 00               ....                          533.1.16                                               
  27.1                             14  IN     94 86 ff 7f  00 80 ff 7f  ........           15us       534.1.0        2019/05/16  21:24:53.658  hidclass      
                                              00 80 00 40  00 f8        ...@..                        534.1.8                                                
  26.1                             20  IN     00 14 00 00  00 00 23 04  ......#.          7.9ms       535.1.0        2019/05/16  21:24:53.666  ntoskrnl      
                                              00 00 00 00  00 00 00 00  ........                      535.1.8                                                
                                              00 00 00 00               ....                          535.1.16                                               
  27.1                             14  IN     23 84 ff 7f  00 80 ff 7f  #.......           13us       536.1.0        2019/05/16  21:24:53.666  hidclass      
                                              00 80 00 40  00 f8        ...@..                        536.1.8                                                
  26.1                             20  IN     00 14 00 00  00 00 83 04  ........          7.9ms       537.1.0        2019/05/16  21:24:53.674  ntoskrnl      
                                              00 00 00 00  00 00 00 00  ........                      537.1.8                                                
                                              00 00 00 00               ....                          537.1.16                                               
  27.1                             14  IN     83 84 ff 7f  00 80 ff 7f  ........           12us       538.1.0        2019/05/16  21:24:53.674  hidclass      
                                              00 80 00 40  00 f8        ...@..                        538.1.8                                                
  26.1                             20  IN     00 14 00 00  00 00 23 04  ......#.          7.9ms       539.1.0        2019/05/16  21:24:53.682  ntoskrnl      
                                              00 00 00 00  00 00 00 00  ........                      539.1.8                                                
                                              00 00 00 00               ....                          539.1.16                                               
  27.1                             14  IN     23 84 ff 7f  00 80 ff 7f  #.......           12us       540.1.0        2019/05/16  21:24:53.682  hidclass      
                                              00 80 00 40  00 f8        ...@..                        540.1.8                                                
  26.1                             20  IN     00 14 00 00  00 00 47 04  ......G.          7.9ms       541.1.0        2019/05/16  21:24:53.690  ntoskrnl      
                                              00 00 00 00  00 00 00 00  ........                      541.1.8                                                
                                              00 00 00 00               ....                          541.1.16                                               
  27.1                             14  IN     47 84 ff 7f  00 80 ff 7f  G.......           12us       542.1.0        2019/05/16  21:24:53.690  hidclass      
                                              00 80 00 40  00 f8        ...@..                        542.1.8                                                
  26.1                             20  IN     00 14 00 00  00 00 ea 02  ........          7.9ms       543.1.0        2019/05/16  21:24:53.698  ntoskrnl      
                                              00 00 00 00  00 00 00 00  ........                      543.1.8                                                
                                              00 00 00 00               ....                          543.1.16                                               
  27.1                             14  IN     ea 82 ff 7f  00 80 ff 7f  ........           16us       544.1.0        2019/05/16  21:24:53.698  hidclass      
                                              00 80 00 40  00 f8        ...@..                        544.1.8                                                
  26.1                             20  IN     00 14 00 00  00 00 b9 06  ........          7.9ms       545.1.0        2019/05/16  21:24:53.706  ntoskrnl      
                                              00 00 00 00  00 00 00 00  ........                      545.1.8                                                
                                              00 00 00 00               ....                          545.1.16                                               
  27.1                             14  IN     b9 86 ff 7f  00 80 ff 7f  ........           12us       546.1.0        2019/05/16  21:24:53.706  hidclass      
                                              00 80 00 40  00 f8        ...@..                        546.1.8                                                
